post_id,post_text,rationale_count,annotator_1_label,annotator_1_target,annotator_2_label,annotator_2_target,annotator_3_label,annotator_3_target,label
19084094_gab,the dirty wee paki that lives beside me came to my house there very upset said racists have been putting threatening letters through his door turns out it was a fiver off soap coupons,3,offensive,Indian,hatespeech,"Other, Islam",hatespeech,Asian,hatespeech
18016424_gab,wrong for not throwing the arabs out earlier like <number> and take har habayit fully no one would have blinked israel here to stay,2,offensive,Arab,offensive,Arab,hatespeech,Arab,offensive
1178695674587684864_twitter,being queer is like your sadness can be cured by haircut and new second hand clothes,0,normal,,normal,,normal,,normal
12954516_gab,go to an inner city majority black elementary school and ask kids about their parents and you will quickly come to understand what the real issue is and it has nothing to do with white people,0,hatespeech,"African, Caucasian",offensive,African,normal,African,hatespeech
1178849207567798272_twitter,so in new york if you say illegal alien you will be fined <money> <number> it you are attacked or raped by an illegal alien it a crime to call ice hm kinda fucked up to be an american in new york,0,normal,,normal,,normal,,normal
1738721_gab,now that trump has won can a black chicks movie please be made <number> white comedians in black face satirizing stereotypical black women equality,2,hatespeech,African,hatespeech,"African, Caucasian, Women",offensive,African,hatespeech
16751878_gab,back on gab after another fucking coons age,3,hatespeech,African,hatespeech,African,hatespeech,African,hatespeech
1269569431832838144_twitter,fuck i should have said queer not homosexual in my reply 😔 😔,0,offensive,Homosexual,normal,Homosexual,hatespeech,Homosexual,offensive
11673530_gab,remember when jews used their media to tell you that the germans were the bad guys they are doing to the same thing to americans right now,0,normal,Jewish,offensive,Jewish,hatespeech,Jewish,normal
27857599_gab,that where corrupt gay boy obama was raised,2,offensive,Homosexual,offensive,Homosexual,offensive,Homosexual,offensive
9746964_gab,true no substitute for a pillow princess pussy but a good cocksucking sissy is not without her merits too just gotta show who boss and keep medical records especially now that the healthcare system getting gutted again grab a medical slut before they are all gone,2,offensive,Women,offensive,,offensive,Women,offensive
9788820_gab,i hope these n-word poachers get tortured to death slowly,2,hatespeech,African,normal,,hatespeech,African,hatespeech
15024908_gab,the only people trump is playing chess against are the american people the jew controlled alt right are full of liars and traitors ask yourselves would adolf hitler shake netanyahu hand would he prostrate himself like a bitch before the wailing wall,2,hatespeech,Jewish,hatespeech,Jewish,offensive,"Jewish, Women",hatespeech
7391418_gab,why are you only saying whites like other races support islam i dont even think if whites band together it will be enough whites blacks asians and hispanics need to band together,2,normal,,hatespeech,Islam,hatespeech,Islam,hatespeech
24738592_gab,no only mates mucking round in a boxing gym in a once white ghetto recently turned black,2,offensive,African,normal,"African, Caucasian",offensive,African,offensive
1168186212894564352_twitter,hadez do not wanna talk to u bitches stop suzi,0,normal,,normal,,offensive,"Women, Other",normal
16973360_gab,in the oregon gay couple bake case the bakery lost in appeal court and has to pay mucho dineros to lesbo couple so now the state tells you how you can run your business sound orwellian to me hope it goes to scourt,0,normal,Homosexual,normal,"Homosexual, Men",offensive,Homosexual,normal
15862681_gab,the alt right is full of feminists white knight captain save a hoe beta cucks,2,offensive,"Caucasian, Women",hatespeech,"Men, Women",hatespeech,"Caucasian, Women",hatespeech
5077714_gab,it allowed the anglo hating p.e. trudeau to shove french down the throats of all canadians while qc persecuted the anglos out all while fast tracking moslem migrants from france former colonies in n africa <number> result was the 2 nd gen moslem terror aka the <number> mtl massacre,0,hatespeech,"Refugee, Islam",normal,,normal,,normal
11303329_gab,bobamas homeland security dept did the same thing their first directive was to target military returning from theater as potential internal terrorist threat meanwhile bobama was inviting the muslim brotherhood into the white house to turn over all our secrets to them on a daily basis,2,hatespeech,Islam,hatespeech,Islam,normal,Islam,hatespeech
1103080607226064897_twitter,do you still have balls albert faggot bitch i am shocked this community has not dragged your carcass thru the streets,3,offensive,Homosexual,offensive,Homosexual,offensive,Homosexual,offensive
1144975366546759681_twitter,new to nsfw twitter • <number> • us • soft hard dom • single • lesbian • she her lt <number> rt for mutual,2,offensive,Other,offensive,"Homosexual, Women",normal,,offensive
8038951_gab,just remember that the bitch commie girlies and their low iq muds are going to slink beneath the shield of the cuckservatives and alt lite when their independent operation folds like a congolese coup then we will have our civil war with someone who can fight,2,offensive,"African, Women",normal,,offensive,"African, Women",offensive
25054107_gab,justin you fucking retarded asshole get this through your thick skull once and for all even the globalist scumbags running the un will not pick a retard like you to be the secretary general,2,offensive,Other,normal,Other,offensive,Other,offensive
16598187_gab,second post a b bitcoin from you on gabnews today are you moving into bitcoin business now thought you were on mission to bring justice to young raped victims all is good but just want to have a clear understanding in my own mind god bless america merry christmas,0,normal,,normal,Other,hatespeech,Asian,normal
4301337_gab,this should not be called or even considered womensmarch real women do not lend themselves or rely on this new feminist bullshit its superflous judgejudy said it best when she owned katie couric these girls have no love let alone respect for themselves in return they recieve none slagfest,2,offensive,Women,offensive,Women,normal,,offensive
19046707_gab,i am not going to thank a n-word for inventions he did not actually create,3,hatespeech,African,hatespeech,African,hatespeech,African,hatespeech
21624055_gab,saudi arabia who behead more people than isis is welcome in uk jihadis are welcomed back in uk conservative journalists in their <number> are terrorists deported denied entry in uk trump is vilified moslem khants say he not welcome in uk he is welcome to the uk asylum hahahahahahahahahha,0,normal,,normal,,normal,,normal
13874243_gab,thank you god bless the battle is just beginning saudi un using canada to leverage power in usa for more fake refugees terrorists to come west we need help to form a counter lobby one estimate is <number> terrorists under arsa in bangladesh camps the scale of this mutiny is huge,0,hatespeech,Refugee,normal,,offensive,Refugee,hatespeech
13958256_gab,i am sorry but very nice people have assured us that before the evil lbj snookered blacks onto his ghetto reservations they never committed any crimes were doing better than whites and were busy working on cold fusion,2,normal,"African, Caucasian",hatespeech,African,hatespeech,African,hatespeech
15080566_gab,i certainly hope this report is true alwaleed is definitely our enemy they can beat him upside down until all his blood comes out his nose and mouth he epitomizes the jihad supporting filthy rich raghead cocksucker fuckyoualwaleed servesyourighttosufferalwaleed,2,hatespeech,"Arab, Islam",hatespeech,Arab,hatespeech,Islam,hatespeech
25691008_gab,had like <number> followers when gab was cool now its like what the fuck am i doin here n-word,3,offensive,Minority,offensive,African,offensive,African,offensive
22669058_gab,with brown skin lmao i am dying laughing 🤣 🤣 🤣 🤣 🤣 you all must truly have an inferiority complex since you want to claim anyone who did anything great while at the same time calling them sand n-word now you are trying to say they are white lmao jews are white too now right 🤣 🤣,0,normal,,hatespeech,Islam,offensive,"African, Jewish",normal
1178860972762636289_twitter,meanwhile they are called shithole countries,0,normal,,normal,Other,offensive,Refugee,normal
22188689_gab,haha holy fuck just try not to say that guy name in a squeaky hobgoblin yid voice 😂 😂,3,offensive,,offensive,Jewish,offensive,Jewish,offensive
16163917_gab,what kind of ironic about this is that a lot of deep ghetto blacks have asiatic eyes anyone else notice the same thing,2,offensive,African,offensive,"African, Men, Women",offensive,African,offensive
1179074152449368069_twitter,rick ripping that guys throat out to save carl from getting raped by that old hillbilly top <number> savage twd moments,3,offensive,Caucasian,offensive,Caucasian,offensive,,offensive
1139081664821432322_twitter,hsh said seunghyun got her into drugs but her ass was already dealing them back in <number> literallt the dumbest bitch,0,normal,,normal,,normal,,normal
1178507064403992576_twitter,i raped the jews because it rigged dave,3,offensive,Jewish,hatespeech,Jewish,hatespeech,Jewish,hatespeech
18208872_gab,its the islamic signal they are ready and willing to be anally bred by goats or another moslem obviously,3,hatespeech,Islam,hatespeech,Islam,hatespeech,Islam,hatespeech
1144768591599792128_twitter,so tired of all this gay shit,0,normal,Homosexual,offensive,"Homosexual, Other",normal,Homosexual,normal
1176915180292321280_twitter,next world cup winner south africa for captain d cock <number> over and <number> over,0,normal,,normal,,normal,,normal
23568042_gab,we need to gas assad all you so called right wingers supporting a muzzie make me laugh,3,hatespeech,"Islam, Jewish",offensive,Islam,hatespeech,Islam,hatespeech
8152862_gab,black dyke offended that white heterosexuals women feel threatened and uncomfortable by her stalker like behavior also thinks blacks smell bad,3,offensive,Homosexual,hatespeech,"Women, Homosexual",hatespeech,African,hatespeech
1178508968404107264_twitter,just watched <number> videos of gangs of n-word beating up white people and got super blackpilled,0,normal,,hatespeech,African,normal,"African, Caucasian",normal
17896103_gab,fact whites are the only race that care about animals n-word eat them chinks torture them and arabs fuck them,2,hatespeech,"African, Arab, Asian",hatespeech,"African, Arab, Asian",hatespeech,"African, Arab, Asian",hatespeech
20768995_gab,i still think armed blacks are weak sure they can get a rifle an shot someone old or asleep but after that they are they are easy as a hog hunt,2,offensive,"African, Other",hatespeech,African,hatespeech,African,hatespeech
22027929_gab,lol when did i ever say anything about gay sex i simply said your ad hominem attacks were tasty hominem does not mean homosexual hahahahahaha,0,offensive,Homosexual,normal,,normal,,normal
20843716_gab,youtube is cratering at the moment caught discriminating against whites and asians in recruitment bans people for question narrative issues strikes on accounts their safety team disagrees with in bed with the adl far left lunatics pulling the strings edgy hormonal teens running twitter account,0,offensive,Other,normal,,normal,,normal
11619975_gab,oh we got somebody trying to defend the murderous negro community and the drug dealing hispanic community you are also defending those mongrels the islam they say white people are all racist and we can only be racist then their stereotype apply as well,2,offensive,"African, Hispanic, Islam",hatespeech,"African, Arab, Hispanic, Islam",offensive,"African, Hispanic, Islam",offensive
12296231_gab,my mom was watching blues brothers the movie there a part where neo nazis have a rally she said to me mockingly look jews are using blacks to gang up on white people i honestly did not see what was inaccurate about that,2,offensive,"African, Caucasian, Jewish",hatespeech,"African, Jewish",offensive,"African, Jewish",offensive
4911529_gab,in a <number> character ghetto ideas will surely never be exchanged,2,normal,,offensive,African,offensive,Other,offensive
1178503603088019456_twitter,tw rape and violence one of my mom best friends in highschool liked to say fuck em all they are just a bunch of lesbian bootfuckers when he hated people she told me that to my face as a kid did she know lesbians were being beaten and raped for existing,0,normal,,normal,,normal,,normal
19277676_gab,blacks are only <number> of the u.s. population therefore black millionaires and billionaires like oprah samuel l jackson colin kaepernick and countless others confirm my point white america made these blacks extremely wealthy and yet sadly most millennial blacks believe the left lie that their opportunities for success are limited,2,offensive,"African, Caucasian",offensive,African,normal,African,offensive
4603160_gab,judge who blocked part of trumps ban on immigrants is a obama appointed judge and clinton donor what a f 4 ing shock,0,offensive,Refugee,normal,,normal,,normal
1178987503942062080_twitter,the atma contained in me used to occupy the body of oskar schindler there are nine thousand schindler jews who are only going to procreate i will not go near jews or israel until it aspires to or manifests a level of love prevalent at camp echo lake,0,normal,,normal,Jewish,normal,,normal
23590591_gab,shut up you n-word kike learn math n-word commit aggravated assault at a rate <number> × that of whites keep eating soy you feminised cuck enjoy being replaced by baboons who will never get to outer space ever again,3,hatespeech,"African, Jewish",hatespeech,African,hatespeech,"African, Jewish",hatespeech
27268799_gab,my cat is more intelligent and capable of feeling human emotions than a n-word,3,hatespeech,African,hatespeech,African,hatespeech,African,hatespeech
18151699_gab,beaver terraforming vs n-word terraforming,3,hatespeech,African,hatespeech,African,hatespeech,African,hatespeech
27106705_gab,i am the reaction to the shitskin invasion,0,normal,"African, Arab, Asian, Hispanic",normal,,hatespeech,"Arab, Asian",normal
12694921_gab,chrisf206 chrisf206 <number> hours ago watch some episodes of cops and tell me blacks are being singled out for no reason ghetto blacks are fuck ups plain and simple ﻿,2,offensive,African,hatespeech,African,offensive,African,offensive
23739163_gab,we are helpless muzrats seeking asylum from our own muzrat countries p.s. it is our right to take everything away from stupid infidels,3,offensive,Islam,offensive,Islam,hatespeech,"Refugee, Islam",offensive
19865503_gab,lol that for sure deborah only <number> n-word days left,3,hatespeech,African,hatespeech,African,hatespeech,African,hatespeech
1178248136126394369_twitter,raskal redical islamist muslims in switzerland are demanding that the white cross be removed from the swiss national flag because as a christian symbol it no longer corresponds to today multicultural switzerland save the world from them 🙏 🙏 🙏 🙏 🙏 🙏 🙏 🔱 🔱 🔱,0,normal,,normal,,normal,,normal
20780384_gab,because you are not a nog or a kike,3,hatespeech,Jewish,hatespeech,Jewish,hatespeech,"African, Jewish",hatespeech
12645369_gab,jews pull the same shit on online forums close down all criticism of them and ban threaten people in sherdog i mentioned jews in a couple of posts and all of a sudden some mod is leaning on me the fucker has an illuminati avatar,2,offensive,"Jewish, Men, Women",offensive,Jewish,normal,"Jewish, None",offensive
1208141433825366016_twitter,brando is the only one who can out boomer a boomer with being retarded,2,offensive,Other,offensive,,offensive,Other,offensive
20105097_gab,are we going to let this confused dyke bully cunt stroke the dick she does not have this wo man will always be a problem if she is not put back in place smug face and arrogance mixed with false confidence is not a good combination for ugly people,3,hatespeech,"Women, Homosexual",hatespeech,"Women, Homosexual",hatespeech,"Women, Homosexual",hatespeech
14589613_gab,tell me again why the bronze medalist muzzy was given this honor white privilege,3,hatespeech,Islam,hatespeech,Islam,hatespeech,Islam,hatespeech
23664868_gab,no fuck you kike im glab the holocaust happened,2,hatespeech,Jewish,hatespeech,Jewish,hatespeech,Jewish,hatespeech
1092641974409154560_twitter,i think jisoo is cute i do not think btsxblackpink ships are though give it a rest,0,normal,,normal,,normal,,normal
1625915_gab,maga speakfreely if the world already hates you white people if black women already hate white women out of jealousy if black men already hate white men out of inferiority complex if arabs hate whites due to religion what exactly do you have to lose by loving yourself,0,hatespeech,"African, Islam",normal,"African, Arab",offensive,"African, Arab, Men, Women",hatespeech
17048275_gab,check the fucking cianiggers and more kike wars in this fucking thread this is the worst propaganda i have ever seen,2,hatespeech,African,hatespeech,Jewish,hatespeech,African,hatespeech
25725396_gab,ivanka is a traitor she married the filthy kike who is trumps handler trump cucks when he has to and pushes maga when he can most of the meetings between trump and kushner is about how much he has to cuck that day,3,hatespeech,Jewish,hatespeech,Jewish,hatespeech,Jewish,hatespeech
1179077035249061888_twitter,how many times do we have to tell you all that being latina is not a race lol she was saying n-word hard af on her ig i said she said i mean i am latina i said but you are white lmao,0,normal,"Caucasian, Hispanic",offensive,Hispanic,normal,,normal
12295225_gab,the newright is scrambling around the trumpisawhitesupremacist tag trying to prove to racists that trump is not one doing exactly what non whites want it not so much nonwhites as it virtue signalling cowardly guilt ridden white bitches wanting desperately to show how not racist they are,2,offensive,"Caucasian, Men, Women",hatespeech,Women,offensive,Caucasian,offensive
1179042271892627461_twitter,just had such a moment flying saa this evening and all of the african air hostesses just boarded and they all look so nice and so happy and i am so happy to see them 😭 😭 😭 fuck guys i have missed home,0,normal,,normal,,normal,,normal
18059522_gab,with so many switching from twitter to gab they should be known as twitter refugees lol 😎 😃 😂,0,normal,Refugee,normal,,normal,,normal
1178804754434146304_twitter,i fucking hate you now bitch,0,offensive,Women,normal,,normal,Women,normal
13333981_gab,israel needs now that their bitch usa is bankrupt and cant keep sending them 1 0 million per day and nobody wants to be in the commie eu with its extortionate membership fees and fines and profit sharing programs,2,normal,,offensive,Jewish,offensive,Women,offensive
23926775_gab,here truth she a n-word on jew payroll recruiting mestizo street shitter immigrants,3,hatespeech,"African, Jewish",hatespeech,"Refugee, African, Jewish",hatespeech,"Jewish, Other, African, Refugee, Hispanic",hatespeech
1179101835979902976_twitter,all pointed to a human or superhuman intelligence — the breaking of the watercasks to divide the forces the driving of the blacks over the cliff and last and greatest the grim jest of the crimson necklace knotted like a hangman noose about belit white neck,0,normal,,normal,,normal,,normal
15223561_gab,i guess morgan freeman is restricted to only being authorized to play the wise token nog in predominately white movies,0,normal,"African, Caucasian",hatespeech,"African, Men",normal,African,normal
24405990_gab,lmao i read some long ass shiz about they dont know if arabs or jews or whatever invented it i love the hell outta it tho i admit it,0,hatespeech,"Arab, Jewish",normal,"Islam, Jewish",normal,"Arab, Jewish",normal
26587957_gab,uploaded a video the ghetto have invaded from chicago and cali it seems vegas is becoming more of a cesspool,2,offensive,African,offensive,Other,hatespeech,Other,offensive
22733217_gab,fuck the n-word football league,3,hatespeech,African,hatespeech,African,hatespeech,African,hatespeech
11560882_gab,haredi none haredi jews have similar low math scores ashkenazi make up <number> of israel population so nope ashkenazi arent the exception all jews are hybrid mongerels jews are all low i q sand n-word there are no exceptions,2,offensive,"Arab, Islam, Jewish",hatespeech,"Arab, Jewish",hatespeech,Jewish,hatespeech
8562902_gab,let just remind ourselves about these so called refugees are countries are busy importing into europe expand picture for words that sum the situation up britfam deutschefam gabfam,2,normal,,offensive,"Arab, Islam, Men, Women, Refugee",offensive,Refugee,offensive
16936242_gab,piss off kike,3,hatespeech,Jewish,hatespeech,"Other, Other, Caucasian, Jewish, Other",hatespeech,Jewish,hatespeech
1179094143907311617_twitter,that <number> y o girl lied about them white boys cutting her hair off smh 🤧,0,normal,,normal,,normal,,normal
22373929_gab,as usual it was just another pussy hat wearing faggot and dyke march,3,hatespeech,"Jewish, Homosexual",hatespeech,Homosexual,hatespeech,Homosexual,hatespeech
5526064_gab,most left wing jews hate israel which you well know most left wing jews are communist not zionist you are an idiot a disgrace to the white race,2,hatespeech,Jewish,offensive,"Caucasian, Jewish",hatespeech,Jewish,hatespeech
21108185_gab,a kike and an infamous boy buggering faggot every single time,3,hatespeech,Jewish,hatespeech,"Jewish, Homosexual",hatespeech,"Jewish, Other",hatespeech
1189017181763166208_twitter,the way i fucking hate my school,2,hatespeech,,hatespeech,Other,normal,,hatespeech
6087970_gab,i make awesome double peanut butter cookies with peanut butter chips i have never heard of pistachio cream cheese i will have to look that up as far as women offering compliments i was bullied relentlessly by some ruthless bitches growing up,0,normal,,offensive,Women,normal,,normal
16823274_gab,n-word porch monkey tree fruit neggra niggress ol black joe,2,hatespeech,African,hatespeech,African,hatespeech,African,hatespeech
1254517888599429125_twitter,i am confused how a president blocked stimulus checks for those who married to immigrants while he himself married to an immigrant,0,offensive,,normal,Refugee,normal,Refugee,normal
17074293_gab,agreed and riyadh and any another place in that cesspool they congregate as i said level them both if we ever want world peace there are a couple billion fundie raghead that gotta go,2,hatespeech,"Arab, Islam",hatespeech,Arab,hatespeech,Arab,hatespeech
1178754764043165699_twitter,queer eye but instead of showing cishet mildly homophobic people how to do stuff they just throw bricks at them,0,normal,,hatespeech,Homosexual,normal,,normal
16445108_gab,democrats refuse to accept the <number> election yet they bitch about roy moore refusing to accept the alabama special election which looked fake af,0,normal,Other,normal,,offensive,Other,normal
15897074_gab,a coming leftist sjw argument on equality we should take kids from straight parents until lesbians and gay men see equity,0,offensive,Homosexual,hatespeech,Homosexual,normal,Homosexual,offensive
1089595139692089349_twitter,that diva munhoe gyal tweets excite aru that the life you all want,0,normal,,normal,,normal,,normal
13379296_gab,lol trump is gutting that n-word bitch like a carp,3,offensive,"Women, African",hatespeech,"Women, African",hatespeech,"African, Women",hatespeech
1178956180216934400_twitter,muslim countries r so safe that all refugees prefer not to go to any muslim country,0,normal,,normal,,normal,,normal
22168671_gab,life under n-word rule <number>,3,offensive,African,hatespeech,African,hatespeech,African,hatespeech
19405861_gab,really alex jones believes that the arabs in israel need to return to jordan where they actually came from because that my two state solution israel and jordan done and done,0,normal,,normal,"Arab, Islam, Jewish, Refugee",normal,,normal
5648766_gab,anti fa queers are planning to disrupt the march 4 trump rallies they will cause violence and try to portray us as the aggressors what did i just say about the american spring yesterday i said they love starting wars around the spring equinox will this be our lexington and concord we will see,0,normal,,normal,,normal,Homosexual,normal
1179097156629798917_twitter,lmao i am reading about how capitalism is gonna kill all of us and also listening to the newsies soundtrack in conclusion we are canceling men and capitalism gotta find a new major now,0,normal,,normal,,normal,,normal
11570079_gab,if there anything that those angry young white boys that have their pants to their knees have shown us is that being black or n-word is more of a lifestyle choice and an actual race thing,2,offensive,"African, Caucasian",hatespeech,African,hatespeech,African,hatespeech
1091215369975545857_twitter,that white bitch on dupd need some dick or something 😂 she forever mad,0,normal,,normal,,offensive,"Caucasian, Women",normal
6484830_gab,more historical dem idiocy <number> ashley judd are equal rights in the constitution <number> rosie o donnell do not fear terrorists they are mothers and fathers <number> sen harry reid on obama light skinned and with no negro dialect gabfam speakfreely chat americans,2,offensive,"African, Men",normal,,offensive,"African, Women",offensive
1223091900422316032_twitter,yall voted dyke shorts kyle lowry over derrick rose whoever voted for lowry should be ashamed,0,normal,,offensive,Other,normal,Homosexual,normal
