post_id,post_text,rationale_count,annotator_1_label,annotator_1_target,annotator_2_label,annotator_2_target,annotator_3_label,annotator_3_target,label
18706002_gab,canada refugee board abruptly changes its scheduling system amid surging backlog,0,normal,Refugee,normal,,normal,Refugee,normal
12664033_gab,no need to dox i read an article that west point has already opened an investigation into this dumbassery he fucked up big time making sich a retarded political statement while in uniform i reckon the only place left for him to go will be starbucks,2,normal,,offensive,,offensive,Other,offensive
27439326_gab,because the sheboon wants violence so race jealous can not control violent impulses,3,hatespeech,"African, Women",offensive,African,offensive,African,offensive
15836567_gab,ancient made up european gods and ancient made up kike gods are the exact same thing if you are not worshiping actual god you are worshipping someone else that someone else is satan does not matter if you call him moloch odin or your ancestor spirit different names same being,3,hatespeech,Jewish,offensive,Jewish,offensive,Jewish,offensive
1179099484837629952_twitter,my n-word like a white girl in a scary movie they be trippin for nothin,0,normal,,normal,,normal,,normal
1121601667999440901_twitter,that shit was not relevant at all white people lame,2,offensive,Caucasian,hatespeech,Caucasian,offensive,Hispanic,offensive
19952264_gab,everytime groid prez obeezy opened his mouth white americans bought guns ammo accessories most polarizing president ever obama claimed he d be bringing ppl together that meant black not ppl unifying not multicultural kumbaya and coca cola,0,normal,,normal,,normal,,normal
25172639_gab,and congress went along with everything the muzrat traitors wanted,3,hatespeech,Islam,offensive,,hatespeech,Islam,hatespeech
20628266_gab,typical sand n-word they are terrorists posing as refugees,2,hatespeech,"Arab, Refugee",hatespeech,Arab,hatespeech,Arab,hatespeech
3243172_gab,my moms friend says i should b more kind <number> the filthy jews so im gonna start calling them grimey jews since im filled with christ love on the christmas holiday even tho the fucking jews murdered jesus who was white,2,hatespeech,Jewish,hatespeech,"Christian, Jewish",hatespeech,Jewish,hatespeech
1179082934357118976_twitter,it is in <number> liberal nazi government party that lit forest fires and cut down toten poles when we left when a guy with hare lip lit forest fires continuously and raped and murdered children left behind and canibalism in <number> on vancouver island tlingiit territory recorded in our,0,normal,,normal,,normal,,normal
19350480_gab,it certainly fugly enough to be a kike bitch,3,hatespeech,"Women, Jewish",hatespeech,"Women, Jewish",hatespeech,Jewish,hatespeech
17188770_gab,i found a hasbara kike everyone,3,hatespeech,Jewish,hatespeech,Islam,hatespeech,Jewish,hatespeech
2704909_gab,big smile on my face when i think about all the college snowflakes who were so close to banning free speech persecuting white males for being white and male popularizing feminism lesbianism and forwarding the end of times how suddenly shitty their lives must be speakfreely maga gab,2,offensive,"Homosexual, Women",offensive,"Homosexual, Other",offensive,Men,offensive
8738595_gab,anyone that says this is normal or it just their religion is your enemy and should be treated as such muslims treat their children and women worse than garbage by rape molestation murder child marriages beatings acid attacks and fgm under sharia this could be your children islam,2,offensive,Islam,normal,,offensive,Islam,offensive
26867693_gab,pretends to have nothing to do with muslim mass migration,0,offensive,"Islam, Refugee",normal,,hatespeech,"Islam, Jewish",offensive
1105440603674955777_twitter,i just want blackpink out of that company,0,normal,,normal,,normal,,normal
25597752_gab,i think our president is brilliant why are women such brainlets,2,offensive,Women,offensive,Women,hatespeech,Women,offensive
1178739480381050882_twitter,now that i have blocked the close minded people i will explain why i have this belief with regards to the hijab and niqab islam came to 7 th century arabia because of how uncivilised they were nothing changed in most arab countries excluding the uae,2,offensive,"Arab, Islam",offensive,Islam,normal,,offensive
25638733_gab,do not like trump and his kike connection,3,hatespeech,Other,hatespeech,Jewish,hatespeech,Jewish,hatespeech
11984565_gab,also jews always project their mentality onto their opponents before they attack them and so far your group is the only group who is doing the projection,2,normal,Jewish,offensive,Jewish,offensive,Jewish,offensive
19514409_gab,illegal aliens should just be called enemy combatants they have killed more americans than the sand n-word have in all of our wars over there daca,2,hatespeech,"Arab, Islam, Refugee",hatespeech,"Arab, Islam, Refugee",offensive,"Arab, Refugee",hatespeech
25610991_gab,works great on muzzies too,3,offensive,Islam,hatespeech,Islam,offensive,Islam,offensive
27834023_gab,these liberal women are literally paying a clothed man wearing a glove to finger them for <number> minute therapy sessions that not therapy that a sexual service and they have plans to expand to other major cities,2,offensive,Women,offensive,Women,normal,Women,offensive
1163018440312967168_twitter,these hoes are insane,2,offensive,Women,normal,,offensive,Women,offensive
19137501_gab,any muslims regardless of where they are is a danger to civilization these guys are lowkey cucks who like watching arabs gangrape their women,2,hatespeech,"Arab, Islam",offensive,Islam,offensive,"Arab, Islam",offensive
27478936_gab,jews will holocaust one of their own if its good for the jews bye bye jew tommy,2,hatespeech,Jewish,offensive,Jewish,hatespeech,Jewish,hatespeech
1142522499831226368_twitter,got into my first car accident 🙄 a bitch was shook,3,offensive,Women,offensive,Women,offensive,Women,offensive
20820201_gab,and trump loves it he is a kike puppet,3,hatespeech,Jewish,hatespeech,Jewish,hatespeech,Jewish,hatespeech
1179072076801462273_twitter,being a moslem javanese living in java is indonesia version of white people getting the best access to basically everything in the us,0,normal,,normal,,normal,,normal
1179084776243945472_twitter,like i am not an autumn 🍂 🥰 faggot but i do want to go apple picking to flex my knowledge of apples and to reconnect with the trees so someone hmu,0,normal,,normal,,hatespeech,Homosexual,normal
1178957335689138177_twitter,why do women care so much about being on the same level as men when men actually do not give f**k <censored> need some education here,0,normal,,normal,,normal,,normal
13110575_gab,lock her up indefinitely in cells filled with the mudslime rapefugees she is demanding her father import to the us,3,hatespeech,Refugee,hatespeech,"Refugee, Islam, Women",hatespeech,Arab,hatespeech
1100177318356619265_twitter,this was the worst thing you could have done to me and i hate you for it,0,hatespeech,,normal,,normal,,normal
21158602_gab,as much i would like it to be true graphic lurid and clear i am fucked if i would like to see pant suit barby without the pant suit the sand n-word possibly but only out of curiosity releasethevideo,2,offensive,Arab,offensive,African,hatespeech,Islam,offensive
15977167_gab,diversity means getting shot by blacks raped by mexicans blown up by arabs and shitty customer service from indians,2,hatespeech,"African, Arab, Hispanic",hatespeech,"African, Arab, Hispanic, Other",hatespeech,"African, Arab, Hispanic",hatespeech
1092081619593252864_twitter,bad lil bitch good brain go to college,3,offensive,Women,offensive,Women,offensive,Women,offensive
1178706099786190850_twitter,i really be wanting these n-word to know i am not the guh for queer baiting,0,normal,Homosexual,offensive,Homosexual,normal,,normal
17987563_gab,indeed hud forcing things makes for unnatural movements that said cant go to the projects model that very clearly does not work you cant make a poverty desert and expect violence to go down so what the solution here serious question,0,normal,,normal,,normal,,normal
19332653_gab,rotherham is the trigger for the world whites allowing the rape of white children by paki muslims and covered up for diversity means many mps councillors police should be swinging from a rope and any fucked up media rep who refuses to see the truth,0,normal,,normal,,normal,,normal
1088890307884838918_twitter,i raped david cameron because it sneezed at me on minecraft,0,normal,,normal,,normal,,normal
21838010_gab,i did not say anything about doing something illegal i repeatedly asked the guy if he was ever planning on doing an event irl he assumed i meant shooting shit up he responded with you are a kike and a shill before blocking me,2,hatespeech,Jewish,hatespeech,Jewish,normal,Jewish,hatespeech
1179051449541480453_twitter,daily <number> women are raped in nepal everyday the same land were women are worshipped as goddess 😢 😑 peace,0,normal,,normal,,normal,,normal
16850498_gab,yet when a n-word was made good on the north side his fellow simians literally camped out on the lawn of the 4 th precinct for weeks,2,offensive,African,hatespeech,African,hatespeech,African,hatespeech
1212081965643583489_twitter,is sucking your own dick gay i ' m not asking for myself,2,offensive,"Homosexual, Men",normal,,offensive,Homosexual,offensive
1162565308663644161_twitter,eight inch big ooh that good pipe bad bitch i ama ride the dick all night,0,normal,Women,normal,,normal,,normal
12182094_gab,idris elba starring in a date movie for coalburners with kate winslet does this filth ever just star in normal movies or play normal roles seems like every one is a political statement against white people,0,hatespeech,"African, Caucasian",offensive,African,normal,,hatespeech
22862647_gab,what sean low t really meant was my wife boyfriend church and by having a blast he really meant the sand n-word were blowing up his wife children,2,hatespeech,Arab,hatespeech,"African, Arab, Men",hatespeech,Islam,hatespeech
9000541_gab,seems the london muzzies get a taste of their own medicine finsbury park,3,offensive,Islam,offensive,Islam,offensive,Islam,offensive
4882319_gab,let us not forget coke ceo is a mudslime and the pepsi one slandered trump have not purchased the products since,3,offensive,Arab,offensive,Islam,hatespeech,Islam,offensive
1142870341846536192_twitter,lmaoaao bitch stop trying to be relevant and move tf on hoe,3,offensive,Women,offensive,Women,offensive,Women,offensive
1171661642561728513_twitter,twomad was having too much fun in overwatch he said live on stream hola my n-word,0,hatespeech,African,normal,African,normal,,normal
27781574_gab,rare photo of the gunmen before fleeing the scene also adios n-word ahaha,3,hatespeech,African,hatespeech,African,hatespeech,African,hatespeech
26425802_gab,lol tell ur based mulatto grandson i said hi faggot,2,hatespeech,"Homosexual, African",hatespeech,"Homosexual, African",hatespeech,"Homosexual, African, Caucasian",hatespeech
1869226_gab,ok watching the kelly bitch on fox showing the altright group some members giving the salute exposure red pill baby <number>,0,normal,,hatespeech,Women,offensive,Caucasian,normal
1179054349517021185_twitter,mm o no hollywood ever n-word treater,3,hatespeech,"African, Women",hatespeech,African,hatespeech,African,hatespeech
11700238_gab,daca in a nutshell fake heroes using illegal immigrants to virtue signal about how unracist they are while purposely omitting the legal ways to become a citizen as a legal haitian american i fully support ending daca,0,offensive,Refugee,normal,Refugee,normal,Refugee,normal
1178881031136403456_twitter,lrt the loud white dude is a fucking fed right like no fucking question,0,normal,,normal,,normal,,normal
13028314_gab,the choice facing western women is not the burka or the brothel but the clitorectomy or the cloister whitesharia,2,normal,Women,hatespeech,Islam,hatespeech,Islam,hatespeech
24385048_gab,sees white decline what have i done,0,normal,Caucasian,normal,Caucasian,normal,Caucasian,normal
17699522_gab,yeh rsi is low macd hanging around <number> bull hammers i do not see it dropping below <number> anytime soon it just waiting to pop question is when maybe i will shill it on biz and see what happens appc in case anyone is retarded and does not know what we are talking about,2,offensive,,offensive,Other,offensive,,offensive
16672566_gab,japan does not have the problem of moslem terrorists rape gangs or negro gangsters ruining their country,3,offensive,"African, Islam",hatespeech,"African, Islam",hatespeech,African,hatespeech
8050276_gab,it true if i am a moderate muzzy and do not stand against the extremists within my religion i am a worthless dog who deserves the title of muzzy terrorist period,2,hatespeech,Islam,hatespeech,Islam,hatespeech,Islam,hatespeech
16129041_gab,shuttener of kike banks,3,hatespeech,Jewish,hatespeech,Jewish,hatespeech,Jewish,hatespeech
10156663_gab,how about <number> what kind of muslim if not already dead really qualifies as refugee,0,offensive,Islam,hatespeech,"Arab, Islam, Refugee",normal,,offensive
27406915_gab,as for jews revenge is the only answer i blame modern christianity for this cuck mentality turn the other cheek must end the jews have flooded our countries with invaders to rape our daughters our people used to live for conquer and revenge its time to rekindle the fire <number>,2,normal,,hatespeech,Jewish,hatespeech,Jewish,hatespeech
27997868_gab,assuming we are on the same side edgy morons like yourself are the enemy have fun alienating people who do not worship your kike on a stick,3,hatespeech,Jewish,offensive,Other,hatespeech,Jewish,hatespeech
1178839564435234818_twitter,since i been at this school you n-word have never not complained about the homecoming artist give it up,0,normal,African,offensive,African,normal,,normal
1178629960837275649_twitter,i hate these faggots 🤷 🏾 ‍ ♂️,3,hatespeech,Homosexual,hatespeech,Homosexual,hatespeech,Homosexual,hatespeech
19457594_gab,criminal in chief his new moniker from bendover and ghetto mouse,2,offensive,Other,offensive,African,hatespeech,Jewish,offensive
3426717_gab,considering many europeans have now been raped and killed horriby by islamic hoardes i wonder what the media reaction when the backlash comes it is bound to happen no doubt they will condemn it as a white nazi hate crime and come down hard on anyone critical of islam banislam,2,hatespeech,Caucasian,hatespeech,"Arab, Islam, Men, Women, Refugee",offensive,"Arab, Islam",hatespeech
5317564_gab,i want to know what the refugees have been told about where they are going my suspicion is that soros filled their heads with fake news of free houses free money fresh new mosques and blonde infidel women just waiting to help them in times of sexual emergency politics news,0,hatespeech,Refugee,normal,"Women, Refugee",offensive,Refugee,hatespeech
21349337_gab,just me this is america we have enough to handle right now i love these people demanding things in america islam demands jews demand no americans will end islam they know it is coming wow,2,normal,,offensive,"Islam, Jewish",offensive,"Islam, Jewish",offensive
4582509_gab,you invited sandnigger child rapng muzzies into your home and you are still allowed custody of your own children,0,normal,Islam,hatespeech,"Arab, Islam, Men, Women",offensive,Islam,normal
13363113_gab,n-word kike spic chink faggot pussy cunt bitch sandnigger jap nip leaf fuck shit crap queer jews aa,2,hatespeech,"African, Arab, Jewish",offensive,"Homosexual, African, Arab, Asian, Hispanic, Jewish",hatespeech,"Homosexual, African, Arab, Hispanic, Jewish",hatespeech
18721090_gab,the labour party has <number> mps in prison for paedophilia <number> mps and councillors on the sex registry <number> million white kids raped by paki muslims all labour voters covered up by labour councils mps and a pm,3,hatespeech,Arab,offensive,Islam,hatespeech,Islam,hatespeech
21530730_gab,i see the future of britain as being a wasteland of ancient molten nuclear reactors and mutated arabs running around on camel legs if they have not been eaten by the metre long dire squirrels,2,offensive,Arab,hatespeech,Arab,hatespeech,Islam,hatespeech
21692203_gab,islam is a religion full of paedophiles and thick as shit sand n-word,2,hatespeech,"African, Arab, Islam",hatespeech,"Arab, Islam",hatespeech,"Arab, Islam",hatespeech
12167695_gab,even worse i have read comments defending this vid stating the message is anti violence against all stfu with that noise,2,offensive,,offensive,,normal,,offensive
1090426127804522496_twitter,i ain t got no type n-word like a dyke n-word ion like n-word these shells bigger than shark teeth take a chunk out it ll bite n-word,0,normal,,normal,,offensive,African,normal
1226205386769911808_twitter,abusite in your bio you getting block since you love being ghetto 🤢 🤢 🤢 🤢 🤢,0,offensive,Other,normal,,normal,,normal
4975691_gab,if the moderate liberal left will not denounce violence created by far left anarchists who have attached their band wagon to the progressive platform they deserve everything they get when violence is all you have left you have lost the argument riotingisdomesticterrorism,0,normal,,offensive,Other,normal,"Men, Women",normal
1178762932198481922_twitter,fat n-word with dreads be looking like big ass dykes,3,offensive,"African, Homosexual",offensive,Homosexual,offensive,Homosexual,offensive
23161127_gab,they are basically males who have been rejected by women or they had a bad example of a mother and they think all women must be the same way they are low iq males if anything they are doing a favor to humanity for not breeding and spreading their inferior seed,2,offensive,Men,offensive,Men,offensive,Heterosexual,offensive
8064440_gab,fucking ass eaters with whole cities full of coons and you think britan has a problem detroit is a shithole fix your shit up yankee,3,offensive,African,hatespeech,African,hatespeech,Indigenous,hatespeech
21716968_gab,why was that muzrat pos in austin who vetted him,2,hatespeech,Islam,hatespeech,Arab,normal,,hatespeech
11200659_gab,i am sure you are totally the alpha faggot at the standard fuckparties,2,offensive,Other,hatespeech,Homosexual,offensive,Homosexual,offensive
22188456_gab,i have no idea why anyone would care about jereb whoever that is the adl on the other hand is a large and well armed force completely loyal to jews and only jews that has almost completely undermined white america the only america and must be destroyed,2,hatespeech,Jewish,normal,,hatespeech,Jewish,hatespeech
20327507_gab,did you know that whitegenocide requires helping jews put restrictions in the second ammendment,2,hatespeech,Jewish,hatespeech,"Caucasian, Jewish",offensive,Jewish,hatespeech
1178773740252995586_twitter,white bitches can not tell the difference between cornrows and braids,3,offensive,Caucasian,offensive,"Women, Caucasian",offensive,"Women, Other, Caucasian, Nonreligious, Other",offensive
15337378_gab,potus trump the master strategist is skillfully letting all the leftie moslem supporting traitors out themselves whilst they also show how anti christian european usa white they all are trump is playing them like a piano while he laughs his head off go trump go trump go usa go usa bluehand,3,hatespeech,Islam,hatespeech,Islam,hatespeech,Islam,hatespeech
23083459_gab,if white people should be ashamed for our forfathers slavery then why do arabs get a free pass they are still doing it,2,offensive,"Arab, Caucasian",offensive,"Arab, Islam, Men, Women",offensive,Islam,offensive
9507112_gab,just shoot the bitch then she can come back,2,hatespeech,Women,offensive,Women,hatespeech,Women,hatespeech
1082770541537308672_twitter,mango orange and champagne oysters with pink salt and black pepper,0,normal,,normal,,normal,,normal
1179053050561888256_twitter,if so which bitch dared to lay a finger on him,2,offensive,Women,offensive,Women,normal,,offensive
12589613_gab,it seems that the whole blm movement boomeranged on blacks in the ghettos ytd in <number> homicides in chicago are down from the same period in <number> but are still way up from the same time period in <number>,0,offensive,Other,normal,African,normal,,normal
26426536_gab,<number> gay the rules of mathematics can not contain me,0,offensive,Homosexual,normal,,normal,,normal
20692960_gab,he loves his daughter more than himself doubt he endangers his grandkids yet yid marries his daughter doubt accidentally yids prepared to stub trump from inside they knew that opposition was preparing him for the last <number> years to overthrow order i think for his daughter he would cave in,3,offensive,Jewish,offensive,Islam,hatespeech,Jewish,offensive
14057110_gab,<number> uk mps involved in the cover up of <number> million white children raped by paki muslims resign all of you filthy bastards,3,offensive,"Caucasian, Islam",hatespeech,Other,hatespeech,Islam,hatespeech
13284688_gab,soon you will be thrown in jail for giving some rag head moslem bitch a funny look or not giving her your seat on the bus,2,hatespeech,Islam,offensive,"Islam, Other",offensive,Islam,offensive
13640701_gab,of all the women coming forward lately to accuse prominent men of sexual harassment or rape this woman has to be the bravest thus far,0,normal,"Men, Women",normal,Women,normal,,normal
22672128_gab,i am not surprised thousands of <number> iq sand n-word lack the intelligence to understand what a malthusian trap is i look forward to the days when egyptian arabs have to resort to slaughtering millions of n-word just so they have enough fresh water to drink,2,hatespeech,"African, Arab",offensive,"African, Arab, Islam",hatespeech,"African, Arab",hatespeech
1087775382177230848_twitter,ho busy hore ka zounung tse tonight makgoa on their balcony motho with the jams a child hoeletsing ho matasa,0,normal,,normal,,normal,,normal
1246071447644143617_twitter,lol now im worried i will post my dressing up as bts albums pics and someone is gonna bash me for being muslim and posting my outfit,2,offensive,Islam,offensive,,normal,Islam,offensive
9844016_gab,gas all n-word jews the world over presto most if not all racism ends,2,hatespeech,"African, Jewish, Men, Women",hatespeech,"African, Jewish",hatespeech,"African, Jewish",hatespeech
14441243_gab,stfu up woman stop larping with your lame ass reposting account no one likes mexicans you are only slightly above a n-word and below a jew,3,offensive,"Hispanic, Jewish",offensive,"Women, African, Jewish",hatespeech,"African, Jewish, Hispanic",offensive
14269466_gab,ffs people do unto others does not let foreigners and n-word come to your country and screw your daughters,2,hatespeech,"African, Men, Women",hatespeech,"African, Refugee",hatespeech,"African, Refugee",hatespeech
1179033597312790528_twitter,<number> minutes to be a faggot,3,offensive,Homosexual,offensive,Homosexual,offensive,Homosexual,offensive
26699755_gab,you cant either pussy all talk no action threats accusations hypocrisy and cowardice typical kike rat,3,offensive,Arab,hatespeech,Jewish,hatespeech,Jewish,hatespeech
6144966_gab,right away the n-word goes to muh dik should be legal to decorate the city lampposts with these stupid animals,3,hatespeech,African,hatespeech,African,hatespeech,African,hatespeech
1178807678249918464_twitter,definition from fr muslim this from persian mosolmān or moslemān pl of moslem and this of the ar clás muslim <number> adj who professes islamism ‖ religion of muhammad u t c <number> adj,0,normal,,normal,,normal,,normal
27550280_gab,tds <number> i do not think i have heard such retarded bullshit since <number>,2,offensive,,offensive,,normal,,offensive
1178110624905224192_twitter,shoutout to all the dykes out here still fucking n-word,3,offensive,Homosexual,hatespeech,African,hatespeech,"African, Homosexual",hatespeech
17728508_gab,hahaha no wonder they would like to x him in any way they can lol he is undoing all obummers treasonous moves wonder how many muzzies will deport themselves and not opt to go to the us watch out dearborn mi,3,offensive,"Other, Islam",offensive,Islam,hatespeech,Islam,offensive
26054970_gab,i can see that violence against tv broadcast stations is going to necessarily skyrocket,0,normal,,normal,,offensive,Other,normal
15632048_gab,a random ghetto spongebob meme <number> u,2,offensive,"Heterosexual, African, Christian, Men, None",normal,,offensive,African,offensive
1163262808835985408_twitter,gotham city villains have weird taste in men and women,0,normal,,normal,,normal,,normal
17681514_gab,off to a funeral n-word my cousin was killed by a n-word right after christmas it never ends with you animals,3,hatespeech,African,hatespeech,African,hatespeech,African,hatespeech
2395752_gab,the taiwan call wasn t just an unintentional blunder as first reported by our unimaginative lardass punditry the washington post yeah i know is reporting that the call had been coordinated for some time it was the first message sent to the chicoms that there a new sheriff in town,0,normal,,normal,,normal,,normal
1090787488044670977_twitter,having hoes is a sport dominated by females,3,offensive,Women,offensive,Women,offensive,Women,offensive
9873480_gab,there are white people there at the end dressed in antifa outfits fighting other contingent of whites the police they fight to let in more global refuse overflow so there can be even less whites i also noted a mudshark at the start a middle aged gay couple in the middle and the odd stray white,3,hatespeech,"Other, Caucasian, Homosexual, Women, African, Refugee",offensive,Other,hatespeech,"Other, Homosexual",hatespeech
