post_id,post_text,rationale_count,annotator_1_label,annotator_1_target,annotator_2_label,annotator_2_target,annotator_3_label,annotator_3_target,label
21743340_gab,white children being raped by pakistani moslem men is of no interest to me its a small price to pay for a more diverse multicultural society jack straw former labour mp minister in tony blairs government,0,normal,,hatespeech,"Caucasian, Refugee, Islam",normal,,normal
19806318_gab,yawn look the book up boomer kike it written by a kike like you you know a degenerate coward yid <happy>,3,hatespeech,Jewish,hatespeech,Jewish,hatespeech,Jewish,hatespeech
11980925_gab,a majority white area is a suburb a majority non white area is a ghetto,2,offensive,"African, Caucasian",offensive,African,offensive,African,offensive
19348796_gab,i have been swinging hammers for <number> years i ain t never seen a kike in my industry unless he was shlmeeling a product or taking graff from a trade union and you can take that to the bank,3,hatespeech,Jewish,hatespeech,Jewish,hatespeech,Jewish,hatespeech
20897534_gab,yes the backdoor part of this war will be dhimmi socialists who will always infiltrate and attack the the patriots and side with islam while their own daughters are being raped and sold by muslims,2,hatespeech,Islam,offensive,Islam,hatespeech,Islam,hatespeech
8075835_gab,you show me a muslim and i will show you an inbred illiterate goat humping woman raping head chopping evil lowlife gutter scum pos,2,hatespeech,Islam,hatespeech,"Arab, Islam",hatespeech,Islam,hatespeech
1185184833640652800_twitter,is slutshaming still a thing yikes,0,normal,,normal,,normal,,normal
1179076934522638336_twitter,stop comparing asians the term is broad and refers to a massive spectrum of culture history and appearances east asians are valid south east asians are valid caucasians west asians are valid,0,normal,,normal,,normal,,normal
9601617_gab,women have never been in charge of establishing and protecting territory so it no surprise that they have zero instincts in this area and it why so many of the refugees welcome crowd is women or weak beta men the <number> groups are interchangeable psychologically,2,hatespeech,"Women, Refugee",offensive,"Women, Refugee",hatespeech,"Women, Refugee",hatespeech
17440187_gab,it possible of course that blacks have souls just as it is possible that jews have souls possible but not likely,2,hatespeech,"African, Jewish",offensive,"African, Jewish",hatespeech,"African, Jewish",hatespeech
26003312_gab,n-word told a lie 😳 naacp leader racial profiling claim challenged after bodycam footage released fox news,3,hatespeech,African,hatespeech,African,offensive,African,hatespeech
19398091_gab,you see one of the great things about finally just admitting the problem with jews is when you see anything they try to spout off you can automatically file it under deceptive kike trying to tear down society without even having to bother reading it,3,hatespeech,Jewish,hatespeech,Jewish,hatespeech,Jewish,hatespeech
17829883_gab,yeah we will see about that you fat sheboon black bitch,3,hatespeech,"Other, African, Women",offensive,African,hatespeech,African,hatespeech
20617485_gab,<number> announcement that fucking kike drudge just gave me the biggest blue balls,3,hatespeech,Jewish,hatespeech,Jewish,hatespeech,Jewish,hatespeech
18151553_gab,i can talk to whoever i want faggot,2,offensive,Homosexual,offensive,Homosexual,offensive,Homosexual,offensive
1103815347537367041_twitter,nobody will love you harder than a pisces girl u just gotta deal with her being fucking retarded,2,offensive,Women,offensive,,offensive,Women,offensive
13201167_gab,jesus i think for me personally the most annoying thing about this whole mess is that so so so many of these women like to screech peddle their mostly feminazi pro woman bullshit when it all lies hypocrisy,2,hatespeech,Women,offensive,Women,offensive,Women,offensive
26820144_gab,most uncomfortable with trump kike connection hell his grandchildren are jews not good,3,hatespeech,Jewish,hatespeech,,hatespeech,Jewish,hatespeech
21766022_gab,i recommend the film no escape to everyone to see how evil asians can be in a race war,0,hatespeech,Asian,offensive,Asian,normal,Asian,hatespeech
7694251_gab,the screeching of the left is approaching <number> decibels or so it will not be long before they join muslim jihadists in upper level massed political violence beyond a few rocks molotov cocktails or isolated i hate fill in the blank people like all good and stupid commies beprepared,0,offensive,Other,hatespeech,"Islam, Refugee",normal,,offensive
15412073_gab,this toxic thinking is exactly the bullshit that is leading to the erosion of our country stand for your beliefs or live in a world of trannies faggots and muslims that hate you libertarianism is how the left tricks the right in to capitulating,2,hatespeech,"Homosexual, Arab, Other",hatespeech,"Homosexual, Islam",hatespeech,"Homosexual, Islam",hatespeech
1212102253492023297_twitter,<number> year old white women who ship r*ylo <censored> i don ' t expect you to understand because you ' re not a minority,0,offensive,Other,normal,,normal,,normal
7506086_gab,i have to see n-word at work in cars at stores just about every fucking where but one fucking place i refuse to see them is in my home that includes the tv muh sportsball,2,hatespeech,African,hatespeech,"African, Men, Women",hatespeech,African,hatespeech
15843155_gab,i am still sad i have been trying to make my phone work so it will take pictures the rooftops are all white in my neighborhood and it so lovely i hate my phone right now,0,normal,,normal,,offensive,"African, Arab, Asian, Hispanic",normal
19256366_gab,wholeheartedly agree unlike the rest of europe magyarország will keep their culture and laws and not allow moslem inbreeds and shariah fucked laws,2,offensive,Islam,hatespeech,Islam,hatespeech,"Arab, Islam, Refugee",hatespeech
5794669_gab,the left is not attacking me because i am a white male or a racist if that were true they would not call black conservatives coons or attack conservative females they just use my gender and skin color to condemn my political views,3,hatespeech,"African, Women",offensive,African,hatespeech,African,hatespeech
21342377_gab,fagrepublic ireland south african n-word ordered to be deported and awarded <money> scholarship,3,hatespeech,"African, Refugee",hatespeech,African,hatespeech,African,hatespeech
20753988_gab,so your theory is whites in america are retarded for allowing in so many diverse immigrants but africa is supposed to be cool with it makes a lot of sense i smell bullshit,0,normal,"African, Caucasian",hatespeech,"African, Hispanic, Refugee",offensive,Refugee,normal
1836235_gab,y know how rich black athletes move from the ghetto into the mansion district and immediately try to turn their new neighborhood into an upscale ghetto that is exactly what the liberals migrating to fl are doing turning it into a purple state go back to your liberal northern shit holes,2,offensive,African,hatespeech,African,hatespeech,African,hatespeech
1097714439825051648_twitter,assistam crazy rich asians mt boom,0,normal,Asian,offensive,Asian,hatespeech,Asian,normal
2237880_gab,notice how the bbc split the immigration figure up so it appears less than <number> maybe they can also split it so it shows number of moslem fanatics came in,3,hatespeech,Islam,hatespeech,Islam,hatespeech,Islam,hatespeech
12466309_gab,you have got to be a special kind of stupid to get into one of these rape victim transport systems piloted by goathumping sandniggers,2,hatespeech,"Arab, Islam, Men, Women",hatespeech,"African, Islam",offensive,Islam,hatespeech
1162934206793748481_twitter,sleeping alone is ghetto 😭,0,offensive,African,normal,,normal,,normal
1107038725773627393_twitter,noir is so good you gays,2,offensive,Homosexual,normal,Homosexual,offensive,"Homosexual, Other",offensive
1178129349788098560_twitter,today i changed out of a dick van dyke t shirt and into a dick van dyke sweatshirt i am so powerful,0,normal,,normal,,normal,,normal
21162364_gab,mad about being the lady with the muslim husband is she not the lady with the muslim husband i d of labeled it that too at least it did not say the bitch with the sand n-word husband what do these ass holes want anyway,2,hatespeech,"African, Islam",offensive,Arab,hatespeech,"Arab, Islam, Women",hatespeech
1182391329013325824_twitter,having a car too much work i am tired of gas changing the oil need new brakes and now tires this is ghetto,0,offensive,,normal,,normal,,normal
14739088_gab,hes just a sand n-word subhuman,2,hatespeech,"Arab, Islam",offensive,"Arab, Islam",hatespeech,Arab,hatespeech
15861145_gab,president trump on why he ran for president i saw what was happening to our country and it wasn t good i took this job on behalf of the forgotten men and women of our country but guess what they are forgotten no more,0,normal,,normal,,normal,,normal
26636662_gab,so the day that starbucks closed down so that they could reprogram train their employees to cater to shitskins where do you think the jews and their useful idiots went to get their daily brew or did they buy a k cup machine with a nintendo switch charging dock,2,hatespeech,"African, Arab, Jewish",offensive,,offensive,"Jewish, Other",offensive
1179098555606130689_twitter,f*ck <censored> white gays and f*ck <censored> their smelly loose cyst infested assholes they are the epitome of hypocrisy the pinnacle of being a musty thieves that perpetuate stereotypes on the queer community of color but love to adopt mannerisms when it in their convenience,3,offensive,,hatespeech,"Caucasian, Homosexual",hatespeech,"Caucasian, Homosexual",hatespeech
1178790620896354310_twitter,how the fuck did that n-word secured this my head is so hot,3,hatespeech,African,hatespeech,African,hatespeech,African,hatespeech
21396361_gab,and islam is not even a race so how can it be considered racism in the first place,0,normal,,normal,Islam,normal,Islam,normal
1091287948237176833_twitter,maria bartiromo at record speed and extremists have to host refugees as this administration over <number> legislation approvals,0,normal,,normal,,normal,"Refugee, Other",normal
16881866_gab,my guess is he a boomer that believes america is some sorta proposition nation but seriously i doubt bill or tom would argue how blacks could be successful too but only if they were oppressed like the jew oh,2,offensive,"African, Jewish",offensive,Jewish,hatespeech,"African, Jewish",offensive
11671275_gab,omfg can we please stop fucking bickering about censoring and freedom and policies and can we please just be thankful that the fat bitch is dead 😑 😑 😑,2,hatespeech,,offensive,Women,offensive,Women,offensive
8212775_gab,with already have hillary here that one crazy ass bitch too many i hope he gets her so upset her panties twist up and squeeze her nuts,2,offensive,Other,offensive,,hatespeech,,offensive
10346937_gab,name one positive thing that blacks or muslimes have brought to the west on their own not things that were created here but things unique to them that they did all by themselves,3,offensive,"African, Islam",offensive,Islam,hatespeech,"African, Islam",offensive
27575832_gab,fooling autistic white guys into making a god of the market place was a heck of a trick,2,normal,,offensive,Caucasian,offensive,"Men, Other",offensive
16954294_gab,yes they can many think moslems will fight well armed white str8 christians instead of easy targets like gay bars others are paid to say moslems are peaceful,2,hatespeech,"Homosexual, Arab, Islam",hatespeech,Islam,offensive,"Homosexual, Arab",hatespeech
25129722_gab,i checked my genes and i am <percent> white can i say im just from one nation no but my race is pure would i change my mind about them if i had yid or neger dna i dont think so i hate ideology more then skin color,3,hatespeech,"African, Caucasian, Jewish",offensive,"African, Jewish",offensive,Jewish,offensive
16119996_gab,i hope a n-word sneaks into his room and rapes him like in kill bill before he finally dies ✝️ 😇 ✝️,3,hatespeech,African,hatespeech,African,hatespeech,African,hatespeech
17843158_gab,lol i forgot to upload my image man but hey i am no n-word or sand n-word i am still better than them atleast my country is not relied on usa eu or un for donations like apefrica and middle east india is a independent state,2,hatespeech,"African, Arab",hatespeech,"African, Arab",hatespeech,"African, Arab",hatespeech
17870625_gab,he threw bacon at a mosque or something went to prison for it and died the implication is that if you make fun of islam or muslims it pretty much a death sentence in europe which puts it on par with other muslim countries in the third world,0,offensive,Islam,normal,,hatespeech,"Arab, Islam",offensive
19949145_gab,snickers have come out with a white chocolate bar ice cream bar i can not stand snickers because i like my candy like i like my women no nuts,2,normal,,offensive,Women,offensive,Other,offensive
1178050983923982337_twitter,britains got talent i was thinking trailer trash but no she funny,2,normal,,offensive,Minority,offensive,"Other, Caucasian",offensive
23637308_gab,monday kike n-word kike tuesday n-word kike n-word wednesday kike n-word kike thursday n-word kike n-word friday kike n-word kike saturday n-word kike n-word sunday kike n-word kike repeat yawn,3,hatespeech,"African, Jewish",hatespeech,"African, Jewish",hatespeech,"African, Jewish",hatespeech
26427633_gab,because e should have bee asians and f should have been all the above,0,offensive,Asian,normal,Asian,normal,,normal
16436843_gab,a muzzy wimp real men do not hit women let alone another man kindergarten we were taught you do not hit your fellow class mates judge tells us you assaulted that person do the crime you re doin the time,3,offensive,Islam,hatespeech,Islam,offensive,Islam,offensive
1179088110640074752_twitter,blak n-word fom da hood a niger fom da hood,0,normal,,normal,,normal,,normal
17676423_gab,nc is a powder keg of black violence huge numbers of blax only increasing nc is a beautiful area but slowly it is being destroyed,0,hatespeech,African,normal,,offensive,African,hatespeech
4083561_gab,rosie o makes me physically sick looking at her tranny dyke ass is unbearable and seeing her tweets is just plain laughable good thing i have trump insults of her to get me thru it liberals are mentally ill,3,hatespeech,"Other, Homosexual",hatespeech,Homosexual,hatespeech,"Women, Homosexual",hatespeech
1179103371560718336_twitter,i am such a slut for fresh bedding,3,offensive,Women,offensive,,offensive,Women,offensive
1178883009921130497_twitter,did not let him fuck but i thoroughly enjoyed the company and it made me reconsider being a hoe again,0,offensive,Other,normal,Women,normal,,normal
16335394_gab,the rape upon these women are violence and horrific if only they could have a knife on them act brave toward their abuser and stay calm then strike them when they least expect it these savages deserve no less,0,normal,,normal,,normal,,normal
1117424980080386048_twitter,mullets prevent you from getting a redneck,0,normal,,normal,,normal,,normal
15079049_gab,i know before nixon is what just whites and blacks and asians somebody decided they had to be grouped like they were special,0,offensive,"African, Asian, Caucasian",normal,"African, Asian, Caucasian, Hispanic",normal,,normal
1174514620704415745_twitter,women boobs nude full breasted women camsex site sex cam fetish,0,normal,,normal,,normal,,normal
18130044_gab,pigskins are cannibalistic mentally ill no wonder they are too retarded to breed,2,offensive,Other,hatespeech,"Caucasian, None",hatespeech,Caucasian,hatespeech
1093143978059464704_twitter,highlight of my day being shouted at by some randoms in a car for being ' dressed like a lesbian ',2,offensive,"Homosexual, Women",offensive,"Homosexual, Women",offensive,Homosexual,offensive
13004991_gab,tsekk kike you need a history lesson faggot,3,hatespeech,"Jewish, Homosexual",hatespeech,"Jewish, Homosexual",hatespeech,"Jewish, Homosexual",hatespeech
4873015_gab,hey nfl fox instead of segment promoting black football players how about a tribute to white women raped by black football players although due to time constraints that may be unrealistic,2,offensive,African,offensive,"African, Caucasian, Women",hatespeech,African,offensive
1178692612271661058_twitter,n-word xan said n-word turn lil nas faggots 😂 😂 😂 😂 😂,0,normal,,hatespeech,Homosexual,normal,Homosexual,normal
7121532_gab,cristina laila retweeted jake tapper i guess all of obama ghetto rap star friends are better you know the guys who rap about raping pimping women selling drugs fakenews jake tapper ‏ potus invited sarahpalinusa to dinner and told her to bring some friends,2,offensive,Other,normal,,offensive,African,offensive
27928076_gab,inbred paki thinks he can conquer the west lolzy doe,2,hatespeech,Other,normal,,hatespeech,"Other, Islam",hatespeech
26886280_gab,the abrahamics are the enemies of animals we arayans are the friends filthy muslims 3 rd nation degenerate sand n-word,2,hatespeech,"African, Arab, Islam",hatespeech,"Arab, Islam",hatespeech,"African, Arab, Islam",hatespeech
1179080461341089792_twitter,all white boys do is lie and punch walls,0,offensive,Caucasian,normal,,normal,Caucasian,normal
13203916_gab,would love to see libtards get in this new social media arena so they can actually handle truthful mocking insults without getting their faggot panties twisted and reporting comments like the sackless bitches they are,2,offensive,,offensive,Homosexual,hatespeech,Other,offensive
18480293_gab,well good i thought the damn thing was gay as soon as i saw it fuckn water bottles laptops guns chainsaws what weirdo is going to shove thatuch shit into that ugly ass vest hell he needs to advertise to isis with the dumb ass mess of a vest,2,offensive,"Homosexual, Other",offensive,Islam,hatespeech,Islam,offensive
20714423_gab,like that terrible violence of the american revolution that stopped the red coats from taking american guns we need to stop glorifying self defense and protect the lives and feelings of criminals,0,normal,,offensive,,normal,,normal
14335849_gab,what do you get when you cross a black and a mexican someone who to lazy to steal hear about the retarded gang member he d tag chain link fences with graffiti,2,hatespeech,"African, Hispanic",hatespeech,"African, Hispanic",hatespeech,"African, Hispanic, Other",hatespeech
27002624_gab,for me it every month i refuse to acknowledge n-word pride or any if the others just white pride month,3,hatespeech,African,hatespeech,"African, Caucasian",hatespeech,African,hatespeech
25902138_gab,the muzzies and black churches have always been given a pass this primarily helps conservative churches that have been silent on political issues out of fear of losing their 5 0 1 c3 status,3,hatespeech,Other,offensive,Islam,hatespeech,"African, Islam",hatespeech
1178747940329971712_twitter,pull up blunt smoking to the weed prada n-word,0,offensive,"Economic, African",normal,,normal,African,normal
25590632_gab,leader of dnc is extremist communist his deputy is muslim who believes in sharia together they plan to spread hate intolerance create more division in usa install communism they have begun indoctrinating youths who r stupid enough to believe that world utopia is possible,2,hatespeech,Islam,offensive,Islam,offensive,Other,offensive
10537069_gab,haha social justice vulnerable immigrant communities refugees hahahhaa actually it not funny because that is what happening,0,normal,Refugee,normal,Refugee,hatespeech,Refugee,normal
16081533_gab,keep talking openly and honestly about jewish power keep complaining about white genocide keep fighting for your and your children future no matter what jews or cucks say,2,offensive,Jewish,hatespeech,Jewish,hatespeech,"Jewish, Men",hatespeech
27155762_gab,it the big gay wedding,0,normal,Homosexual,normal,Homosexual,normal,Homosexual,normal
1179088733636685830_twitter,you are banned remember white boy,0,normal,,normal,,normal,,normal
18367092_gab,can i say ghetto rat on here because i got put in twitter jail for calling a guy a ghetto rat after he called me a white privilege cracker nothing happened to him though nope not a thing,0,normal,,hatespeech,"African, Men",offensive,African,normal
13789335_gab,eww a mudshark with a niglet,3,hatespeech,African,hatespeech,"African, Caucasian, Women",hatespeech,African,hatespeech
23697018_gab,the only thing that makes a black ghetto as stinking black men selling drugs and committing crime because it cool and it in the hood these f coons who destroy society should be executed worthless s* screwing <censored> up societies throughout the world f***ing <censored> n-word c**ts <censored>,3,hatespeech,African,hatespeech,African,hatespeech,African,hatespeech
1178813519921373185_twitter,im sorry i do not usually get involved but you are a disgusting human being and i fucking hate you putting other people down because of your shitty mistakes,0,normal,,normal,,normal,,normal
19136881_gab,italy is for italians get the immigrants to go back to their shitholes america is for americans europe is for europeans clear,2,hatespeech,"Heterosexual, Homosexual, African, Arab, Hispanic, Christian, Hindu, Islam, Men, Women, Refugee",hatespeech,"Caucasian, Hispanic, Refugee",hatespeech,Refugee,hatespeech
1177952599225569280_twitter,since campaigning began two months ago more than <number> civilians have been killed and at least <number> injured in election related violence there is a reason the taliban want to control democracy,0,normal,,normal,,normal,,normal
1178762649187868674_twitter,white hall senior school staffs wish fellow nigerians happy independence day,0,normal,,normal,,normal,,normal
13507393_gab,death2fags we r pleased to have met righteous fag bashers beating such park queers even against massive statist agentsofsodom,2,offensive,Homosexual,hatespeech,Homosexual,hatespeech,Homosexual,hatespeech
27165282_gab,<number> <number> the ghetto plantation the ghetto plantation was designed to keep them poor desperate and under control while keeping them voting against their own welfare for decades neo marxist saul alinsky based much of his tactics on the democrats approach to blacks and the us government approach to the native americans,0,normal,,normal,African,normal,African,normal
1179104812924899329_twitter,people who say all lives matter are the same kind of people who comment about there not being a straight pride 🔔 🔚,0,normal,,normal,,normal,,normal
1104254198621696000_twitter,say fellas did somebody mention the door to darkness camera pans to a black coat clad mickey mouse,0,normal,,normal,,normal,,normal
27956816_gab,says the swamp muzzie who fucks goats,3,hatespeech,Islam,hatespeech,Islam,hatespeech,Islam,hatespeech
21782811_gab,the delighted kikes broke his nose via sand n-word proxy,2,hatespeech,"Arab, Jewish",offensive,"Arab, Islam, Jewish",hatespeech,"African, Jewish",hatespeech
1079605192591433730_twitter,damn these hoes don ' t appreciate shit a good man does for em,2,offensive,,offensive,Women,offensive,,offensive
10658326_gab,where is this shit coming from i grew up in the cleveland ghetto in the <number> and black people were there my favorite tool in my pocket was an <number> inch stiletto i carried always nobody ever bothered me,2,offensive,African,offensive,African,normal,African,offensive
1092318023145476098_twitter,the team of gillberg and adam rose defeats bray wyatt via the phoenix splash in a mud bath at the royal rumble,0,normal,,normal,,normal,,normal
18988306_gab,how many niglets does your wife have,3,hatespeech,African,hatespeech,African,hatespeech,African,hatespeech
1179050794865352704_twitter,i am not a bad bitch i am a stupid sad bitch,0,normal,,normal,,normal,,normal
3826117_gab,black lives matter could literally kidnap torture and try and kill a helpless white retarded person and blm supporters would defend it oh wait a minute maga gabfam,2,hatespeech,African,hatespeech,"Men, Women, Other",offensive,African,hatespeech
6702497_gab,men must not confuse chivalry with letting women walk all over you,0,offensive,Women,normal,Women,normal,Women,normal
1114386285387374592_twitter,how are you going to mess with a bitch that looks up to me 💀,0,offensive,,normal,Women,normal,Women,normal
5693900_gab,if its all about optics and given few are as aware as ever with white cloth association with the 1 9 th than what did that sea of seated stone faced silence draped in kk ownership white convey as the soaring american rhetoric filled the chamber,0,offensive,,normal,,hatespeech,African,offensive
11848558_gab,this site still sucks n-word dick,3,hatespeech,African,hatespeech,African,hatespeech,African,hatespeech
11648559_gab,aw i was hoping it was the owner of salon not some chink you owns a salon <sad>,3,offensive,Asian,offensive,Asian,offensive,Asian,offensive
15805591_gab,oh that ll probably go over their heads except for the paranoid oc types who read into stuff more like the lib dykes,3,hatespeech,"Women, Homosexual",offensive,Homosexual,offensive,Homosexual,offensive
1185604394051616771_twitter,men lie women lie but numbers do not lie and neither does frequency 💁 🏾 ‍ ♀️,0,normal,,normal,,normal,,normal
1106263089899552768_twitter,lmaoaoao these n-word are strags,0,hatespeech,African,normal,African,normal,,normal
22834310_gab,your pussy muzzie loving government is killing you off faster than any battlefield aside from a handful of brit your giving your country up just like your parliament wanted to do in <number> here you go hitler we give up you had better resurrect churchill rapidly cuck boy,2,hatespeech,Islam,hatespeech,Islam,offensive,Other,hatespeech
