post_id,post_text,rationale_count,annotator_1_label,annotator_1_target,annotator_2_label,annotator_2_target,annotator_3_label,annotator_3_target,label
14547601_gab,we are accepting donations on behalf of rose west who has really made a remarkable transformation from straight white female killer to east indian lesbian kindly send donations to killerdonations org,0,offensive,Other,normal,"Homosexual, Asian",normal,,normal
1177589485946773504_twitter,prolly heard i am a hoe from a hoe,2,offensive,Women,offensive,Women,normal,,offensive
27977502_gab,no that the little bitch batman ride this is vader daily driver when i am not cruising the galaxy in my tie fighter,0,normal,,offensive,,normal,,normal
1179065366561132544_twitter,ok there was a live action movie of eletra woman and dyna girl so gay,0,normal,,normal,Homosexual,normal,,normal
1178428170015592448_twitter,can you all n-word stop asking if i am sick that just how i look wali idurdkdieej,2,offensive,African,offensive,African,normal,,offensive
1179002593172869123_twitter,sado <number> right from the hill into a stream rover dirty waters crystal clear pig dogs caught on a gutless now hung on the tree dry pierced heart you come with fly and maggots a life lived to eat found faggots bud,3,offensive,Homosexual,offensive,Homosexual,offensive,Homosexual,offensive
12121127_gab,over the last week i was thinking that altretard pedo nazi faggot would become like the ultimate insult and then pewdiepie said n-word and the world came to an end no no apparently even the feelings of the altleft are retarded and unimaginataive,2,offensive,"African, Other",hatespeech,African,offensive,Other,offensive
24525987_gab,wait wut subaru is a lesbian car,0,normal,,normal,"Homosexual, Women",normal,Homosexual,normal
15464915_gab,trump has yet to fulfill a single promise he said he would instead he has resorted to cucky republicrat shit like tax cuts and super awesome trade deals with arabs and asians i am not a cheer leader this guy has done jack shit for me,0,normal,"Arab, Asian",normal,Other,offensive,,normal
16659498_gab,signs in warsaw ghetto warning the jews of typhus germans warning jews about a deadly disease,0,offensive,Jewish,normal,Jewish,normal,Jewish,normal
1178831978935853056_twitter,i knew d wade was gay,0,normal,,normal,,normal,Homosexual,normal
1081965704939749376_twitter,you n-word are absolutely disgusting,3,hatespeech,Other,hatespeech,African,hatespeech,African,hatespeech
1179054169103093761_twitter,<number> amsyar • he used to look more chinese during form one • a bitch • uri dumbass • good advices • he always there if u need him • nice haircut • no emotions most of the time • lowkey hates everyone,3,offensive,"Asian, Women",offensive,Women,offensive,Disability,offensive
15718894_gab,mudsharks set the movement back more than anything just having female leaders sets us back let alone being both female and a n-word lover wn is diametrically opposed to race mixing richard spencer is way better than her she wallows in the mud,3,hatespeech,"Other, African, Caucasian, Women",hatespeech,African,offensive,"Women, African",hatespeech
8257903_gab,they were mad because they d prefer a moslem man raping a dutch pig goat or sheep,2,hatespeech,Islam,hatespeech,Islam,normal,,hatespeech
1178302694169235456_twitter,ya n-word made amiri look dirty ya make everything dirty i hate you dirty mother fuckers ya make luxury items look dirty stick to white tees,0,normal,,hatespeech,African,normal,"Men, African, Caucasian",normal
1178646433957695489_twitter,crowdsourcing hi may alam ba kayong filipino film about domestic violence pls help me huhu thank u,0,normal,,normal,,normal,,normal
12867168_gab,he was a leftist and probably antifa not a white supremacist neonazi kk with a gook wife plus shooting victims being white country music is now the official music of american nationalism,3,offensive,Asian,offensive,Asian,offensive,Asian,offensive
4888316_gab,jesus is this what you want american women you have choices now but you would not if muslims take over forget marching with your vaginas on your faces they mutilate that too what the hell is wrong with you for diversity sake ugh,0,normal,Islam,hatespeech,"Arab, Islam, Women",offensive,"Islam, Women",normal
23956986_gab,you just wrote some n-word words like the low energy obsolete farm equipment you are boy,3,offensive,African,hatespeech,African,hatespeech,African,hatespeech
1115852543911919616_twitter,taeyong keeping that black hair,0,normal,,normal,,normal,,normal
26099353_gab,and it the same retarded re muh joz who hate the removal of topics,2,offensive,,offensive,Jewish,hatespeech,Other,offensive
1263136019597135873_twitter,let make one thing clear you n-word did not have money before the pandemic that why all these hoes was gay 🤫,2,normal,"Homosexual, African, Women",offensive,African,offensive,Homosexual,offensive
1165409508157341696_twitter,not a grammar nazi but,0,normal,,normal,Other,normal,,normal
1171149509637881856_twitter,women go broke and start telling n-word they pregnant so send some abortion money,0,normal,,normal,,normal,,normal
1055823679333023744_twitter,gosh osu has a lot of closeted nazis,2,normal,Other,offensive,,offensive,,offensive
11357038_gab,shows how coopted white reps are izrael is never flooded with refugees,2,normal,"Caucasian, Refugee",offensive,"Jewish, Refugee",offensive,"Islam, Refugee",offensive
1181254867228250112_twitter,weed guys the most emotional n-word ever,0,normal,,normal,,normal,,normal
16109606_gab,she churning out a steady stream of pure kike garbage,3,hatespeech,Jewish,hatespeech,Jewish,hatespeech,Jewish,hatespeech
6984595_gab,you can get motion sensor driveway alarms on amazon pretty cheap i have laid out a perimeter around my house with them in case the dogs are sleeping when some unlucky assclown moslem finally figures out my address <wink>,3,offensive,Islam,hatespeech,Islam,hatespeech,Islam,hatespeech
1219176773482471425_twitter,rough looking n-word pretty boys,2,offensive,African,hatespeech,African,offensive,African,offensive
20055826_gab,god dam i almost sneezed mah lung out i hope dis n-word air i am breathing ain t giving me aids,3,hatespeech,African,hatespeech,African,hatespeech,African,hatespeech
8086600_gab,no muslim cab drivers did anything dear that was a sikh you dumbass,0,offensive,,hatespeech,Other,normal,,offensive
4893156_gab,no they have not the moslem scum that our shitty government let into this country have chosen so fuck you,3,offensive,Islam,hatespeech,Islam,hatespeech,"Refugee, Islam",hatespeech
24543041_gab,st louis is so ghetto ass that compton and harlem thugs will not even roll there,0,normal,,hatespeech,African,offensive,African,normal
22790998_gab,a boycott of these companies is in order for listening to that little twat bitch david hogg who has cursed out several entities and for removing their commercial support for laura ingraham fuck that kid and the companies that support him,2,offensive,,offensive,,hatespeech,Women,offensive
16032022_gab,amy here are substitutions you can use islam isalami muslim mooslime sharia shartia jihad gleehad qur an grranne muhammad fdr fucking donkey rapist muslim brotherhood mooslime rape club jihad sweater vest club islamic isalami sandwich,3,hatespeech,Islam,hatespeech,Islam,hatespeech,Islam,hatespeech
1179091423087316992_twitter,the white devil knows no meaning of the word chil 🤣 🤣 🤣 🤣,3,hatespeech,Caucasian,offensive,Caucasian,hatespeech,Caucasian,hatespeech
18941504_gab,whitegenocide rfid jewish controlled media is not news its a bureau of communist indoctrination or hatenews to make people help the jews create the communist nwo where no white person will be spared and the current generation of black people will become slaves again,2,hatespeech,"Heterosexual, Homosexual, African, Caucasian, Jewish, Men, Women, None",offensive,"African, Jewish",hatespeech,Jewish,hatespeech
13799524_gab,have you proven your gender yet nice profile pic by the way oh im a n-word too,2,hatespeech,African,hatespeech,African,normal,African,hatespeech
11702551_gab,mane he ane do nuffin my ghetto looto numbahs will be fo fo fo and fo,0,hatespeech,African,offensive,,normal,,hatespeech
12818270_gab,the core of the movement is the protection of white identity which they are calling evil there a not small point here white identity is weaker than white race race can not be changed identity sounds like something one chooses,0,normal,"Men, Women",normal,,normal,,normal
23007090_gab,a beaner who tried snitching on atomwaffen and got doxxed,3,hatespeech,Hispanic,hatespeech,Hispanic,hatespeech,Hispanic,hatespeech
1124408781448736768_twitter,i ' m so ducking retarded ugh,2,normal,Other,offensive,Other,offensive,"Men, Women, Other",offensive
8044542_gab,manchester put your mudshark and bombfugees into perspective that attack that left <number> dead is really your bomb you have fought us brining the problems to the fore you have more blood on your hands this pic upset you tho,3,offensive,"Women, Caucasian",hatespeech,"African, Caucasian, Women, Islam",hatespeech,"Refugee, Arab",hatespeech
12621344_gab,interesting note to self determine which dna test the israeli government uses to test immigrants so that unfortunate mis identifications can be avoided during shoah <number> electric boogaloo,2,offensive,Refugee,offensive,Jewish,hatespeech,Other,offensive
1111061738575810561_twitter,i ' m that friend who will call you on a tuesday for margaritas 😂 and you better be ready bitch,0,normal,,normal,,offensive,,normal
8523062_gab,wtf are you talking about retard boy you are rambling now,2,hatespeech,"Men, Women, Other",offensive,Men,offensive,,offensive
18981588_gab,my ignorance proves i know nothing about this n-word comic i am good with that,3,hatespeech,African,hatespeech,African,hatespeech,African,hatespeech
5125277_gab,what an absolutely ignorant negro she gives the good a bad name,2,hatespeech,African,hatespeech,African,offensive,African,hatespeech
15198461_gab,fuck machinehead and pussies like them bringing feminist queers into metal fake trash poisoning the well,3,offensive,Homosexual,hatespeech,Homosexual,hatespeech,"Women, Homosexual",hatespeech
18903937_gab,zecharia sitchin is what happens when an autistic kike finally goes batshit crazy,3,hatespeech,Jewish,hatespeech,Jewish,hatespeech,Jewish,hatespeech
11947712_gab,i see you are hanging on my every word n-word loving whore sorry i do not date mudsharks though,3,hatespeech,"African, Caucasian, Women",hatespeech,African,offensive,African,hatespeech
1109753669367455744_twitter,you can not make a hoe a housewife boycott mafs mafsau mafs,3,offensive,Women,offensive,Women,offensive,Women,offensive
22799173_gab,so just asians now right,0,normal,,normal,,normal,Asian,normal
16166955_gab,wow you are so alpha abusing women on the internet parroting anglin troll articles you just dgaf what these bitches <number> something married women opposing feminism on youtube say so so alpha now go finish your homework before your mom gets angry,2,offensive,Women,offensive,Women,offensive,Other,offensive
22550417_gab,a muslim in sweden asked for isis donations for <number> years on facebook and his account was not deleted,2,offensive,"Arab, Islam, Men, Women, Refugee",normal,,offensive,"Arab, Islam",offensive
15292851_gab,really i have seen men come together that we are atheist buddast odinist christian hell even morman for one cause survival religion and beliefs go out the window in a fox hole buddy so blow that retarded shit up some one else skirt,2,normal,,offensive,Men,offensive,,offensive
26892722_gab,so as men we have penises that look like melted candles but women get something cool as their pussies look like the fucking predator,2,offensive,"Women, None",offensive,Women,offensive,Women,offensive
1179101172625358848_twitter,whoever just messaged me and unsent the message i hate you,0,normal,,normal,,normal,,normal
24396396_gab,these same people also deny the slippery slope of gay marriage lookin pretty legit and slopey there,0,normal,Homosexual,offensive,Homosexual,hatespeech,Homosexual,normal
3486061_gab,if an uninformed person were to watch american tevision black people would appear to represent half the population while latinos asians and native americans would represent <number> this is a lie,2,offensive,"African, Asian, Hispanic, Indigenous",offensive,"African, Asian, Hispanic",offensive,African,offensive
13187518_gab,this n-word is victim stereotype is so ingrained it trumps all factual reality no matter the reporting makes absolutely no sense this is pure ideological thinking where category is all that matters n-word good white man nazi bad facts pale before holy categories by jew,2,normal,,hatespeech,African,hatespeech,African,hatespeech
10783839_gab,ideally yes when push comes to shove id rather live in a white run city country we already know what a planet of apes scenario looks like baltimore chicago philly detroit and every suburban mall failing to shoo flies,2,hatespeech,African,offensive,,hatespeech,African,hatespeech
1170441972492001282_twitter,ab a bitch no matter where he play,0,normal,,normal,,offensive,Men,normal
27463557_gab,according to you what do you do to prove youre not a pussy name one thing you have done that is not pozzed in fact kike loving faggot,2,hatespeech,"Homosexual, Jewish",offensive,"Homosexual, Jewish, Other",hatespeech,"Homosexual, Jewish, Women",hatespeech
21092381_gab,when i see usernames like jill kews or people posting pictures of violence against black civil rights marchers on here i know they are neo bolshevicks here to piss in the well that is and will continue to be a problem with rightist spaces,0,normal,"African, Jewish",normal,"Men, Women",normal,Other,normal
20733800_gab,these jews are so stupid think like a lawyer for a minute you can keep and bear all the arms you want any kind you like no mention of ammunition in the constitution however they could just try to make that illegal,2,offensive,Jewish,hatespeech,Jewish,hatespeech,Jewish,hatespeech
22769538_gab,winning winning winning why is it invariably groids who do this or r they just dumb enuf to get caught i know beaners r doing it also that why nancy and schloch want them in here born here americans will not vote for theses commies any more,3,offensive,Other,hatespeech,Hispanic,hatespeech,"African, Hispanic",hatespeech
24790168_gab,police have always hated pakis up until recently now the police are using pakis to shiw how pc they are but yes police have always hated pakis and white girls seen with them i can assure you no one likes pakis when i was growing up because they are vile people,3,hatespeech,Arab,hatespeech,Other,hatespeech,Indian,hatespeech
17561056_gab,the woman she spoke of was never raped not by six white men not by anybody,2,normal,,offensive,,offensive,Women,offensive
15972746_gab,police are reporting they are on the look out for moslem convert terror suspect al samel haeed,0,offensive,Islam,normal,Arab,normal,Islam,normal
26237918_gab,ghetto corner whore do you know your trailer is whiter than you rolf,2,hatespeech,Women,hatespeech,Women,offensive,,hatespeech
1241937890369630208_twitter,i got to pay for my own birthday nails ghetto,2,offensive,"African, Other",normal,,offensive,,offensive
25466958_gab,perspective what would you were told that police hated you because you are black real or not then seeing things like this done to someone black i challenge you to find something similar done to a white girl especially a rich white girl over a speeding ticket,0,normal,Men,normal,"African, Caucasian",offensive,African,normal
8465700_gab,except it asians that have the lowest odds for given credentials if natural enrollment would be 2 0 a75w5b under affirmative action you get 5 a75w20b whites get another advantage in that 1 5 b will pad the bottom ranks while 1 5 a spaces will open up at the top further advantages in grad rates,0,normal,Caucasian,normal,Other,normal,,normal
22358292_gab,happy with housing wealth yet you moan at the low savings rate get some economics oh where are the grand kids look in the mirror you can have some islam though and more eu workers,0,offensive,Islam,hatespeech,"Arab, Islam",normal,,offensive
23416910_gab,women wtf r u doing,2,offensive,Women,offensive,Women,normal,Women,offensive
18770401_gab,in celebration of holocaust day i want to send a message to all people that jews are overrepresented in positions of power and actively conspire about ending the white race,2,hatespeech,Jewish,hatespeech,"Caucasian, Jewish",hatespeech,Jewish,hatespeech
17789015_gab,someone should find her at home sometime and beat her with a pipe along with their wetback mayor,3,hatespeech,"Women, Hispanic",hatespeech,Hispanic,hatespeech,Hispanic,hatespeech
26592380_gab,of course i just wanted to grammar nazi myself i am feeling mildly retarded today,0,normal,Other,offensive,Other,normal,,normal
15889662_gab,if all the kike news networks have pretty faces with empty heads reading their teleprompters why can not we have hotter smarter ones,3,hatespeech,Jewish,hatespeech,Jewish,hatespeech,Jewish,hatespeech
14680529_gab,dianne abacus abbott waffling on about racism not a word about her own mp talking about token black ghetto boys,2,offensive,"African, Men",normal,,offensive,African,offensive
20447576_gab,it not regardless he a white dude naming the jew with his real name and face out there the retards fawning over him are the same ones that did it about trump,2,offensive,"Jewish, Other",normal,"Hispanic, Jewish",offensive,Jewish,offensive
14708270_gab,moslem migrant <number> i know how to color i also know how to shave and shape my goatie moslem migrant <number> i want to paint a picture of myself with facial hair and i can count to potato,0,normal,,hatespeech,"Refugee, Islam",normal,,normal
14950466_gab,guardamerican draws the line at the sanctity of life unlike your gosnell crowd ethno cleansing blacks more than any nazi ever dreamed that your side the kk venezuela socialism euthenasia all you libs love death conservatives value life,0,offensive,,normal,"Men, Women",hatespeech,"African, Jewish",offensive
24754249_gab,i liked the poor whites left behind angle of twp but who d give a shit about blacks in that situation why are not they seeking out opportunities elsewhere,0,normal,,normal,"African, Caucasian",hatespeech,"African, Men, Women",normal
1257695399126749184_twitter,it ' honestly so cute that some non muslim countries are allowing the call to prayer in ramadan,0,normal,Islam,normal,Islam,normal,"Islam, None",normal
27604258_gab,yeah bro the globalists hate the jews that why they bend over backwards to persecute anyone who criticizes the jews because the jews are the real victims of globalism now this is pilpul,0,normal,Jewish,offensive,Jewish,normal,Jewish,normal
13813737_gab,i bet he a wetback tho she should be calling ice,3,offensive,Hispanic,offensive,Hispanic,offensive,Hispanic,offensive
18416365_gab,stay mad ma snow n-word your women love that non white dick while you all stay cucked with your low sperm count and number of white babies dwindle 😉,2,hatespeech,African,offensive,Caucasian,hatespeech,Other,hatespeech
17588129_gab,george carlin was probably the very first faggot to inject politics into comedy and pass incessant bitching as hilarious rants,0,normal,,offensive,Homosexual,hatespeech,Homosexual,normal
9826529_gab,asians are <number> percent of uc irvine <number> percent of berkeley and <number> percent at ucla your grandkids will be asian and u r worried about a few jews lmao,0,normal,"Asian, Jewish",normal,,offensive,Asian,normal
16387166_gab,thoughts on harry markle relationship a white dumb ex drug addict who dresses up in nazi outfit marries ghetto divorcee approaching 4 0 and ppl are excited low standards libs,2,offensive,,offensive,Other,offensive,,offensive
1204753889129455617_twitter,🎊 🎊 hindu rashtra by midnight 🎉 🎉 one tight slap for fiberals burnol for jihadis and sickulars 🙏 🙏 thank you modi zee 🙏 🙏,2,offensive,Islam,hatespeech,Arab,hatespeech,"Hindu, Islam",hatespeech
1270444314691280903_twitter,if they hate you for being real just ignore that shit,0,normal,,offensive,,normal,,normal
1179078851235856385_twitter,socialjustice shs im shocked to see that there was a film back in the day showing a women would rather kill herself than get raped by a black man implying black men are rapist absurd 😠 😠 😠,0,normal,,normal,,normal,,normal
1179105308561461249_twitter,ima have to pull up to the plant to watch the new joker movie ain t no racist crazy white boy named dylan pulling up there,0,normal,Caucasian,normal,,normal,,normal
13120211_gab,two things racialists dont all grasp racialism does not stop at the racial border it applies within race too to individuals and other subgroups one can be as naive about government capacity as about n-word capacity,3,offensive,African,offensive,African,offensive,African,offensive
1232084437866864640_twitter,some people are straight up retarded 🥴,2,offensive,,offensive,Other,offensive,,offensive
1279173733681332226_twitter,you can be ghetto and not be ratchet i ' m ghetto for sure but fighting all the time is ugly,0,normal,African,offensive,Other,normal,"Men, Women",normal
23500303_gab,more kike propaganda,3,hatespeech,Jewish,hatespeech,Jewish,hatespeech,Jewish,hatespeech
20983237_gab,pls dont talk to me reality is too much for my kike infested mind,3,hatespeech,Jewish,hatespeech,Jewish,hatespeech,Jewish,hatespeech
27627824_gab,i am sure it was probably a niglet,2,offensive,African,normal,,offensive,African,offensive
1185914562824065026_twitter,<percent> of white woman voted for trump,0,normal,,normal,,normal,,normal
1179006612234801153_twitter,if your one of those cunts blocking up the petrol garages so you can get a free costa coffee your a cunt,3,offensive,Women,offensive,Women,offensive,Women,offensive
15859370_gab,i intensely dislike jews i am not going to link up with a filthy white hating n-word who also dislikes them just because he nods to the fuhrer,3,hatespeech,"African, Jewish",hatespeech,"African, Jewish",hatespeech,"African, Jewish",hatespeech
1113570611845058561_twitter,fb so ghetto 😭 😭 whew,0,normal,"Men, Women",offensive,African,hatespeech,Other,normal
23780269_gab,do you lads like yachts are you aware that caligula had the first yachts built out of wood of course not because he was deranged and had sex with a horse maybe just maybe that is a lie no goy <number> gorrillion jews died,0,normal,,normal,,offensive,Jewish,normal
24264232_gab,not for long boomer the kikes are gonna make sure they are all in spanish then they are gonna make you marry off ur daughter to a n-word transexual to prove youre not a bigot cuck,2,hatespeech,"African, Hispanic, Jewish",hatespeech,"African, Hispanic, Jewish, Other",hatespeech,"African, Hispanic, Jewish",hatespeech
17901515_gab,blah blah blah stfu with your delusional retarded socialist bullshit and take it back to europe this country is not for big government authoritarian fucking scums,2,offensive,Other,offensive,,offensive,,offensive
6605751_gab,in a national survey of random samples of homosexuals and heterosexuals <number> of those males who called themselves homosexual or bisexual versus <number> of heterosexual males reported having engaged in sadomasochism <number> of lesbians versus <number> of heterosexual women also admitted to m family r.i.,2,offensive,Homosexual,normal,"Heterosexual, Homosexual, Men, Women",offensive,Homosexual,offensive
25403083_gab,boo hope poor little sick nazi faggot is offended 😁 😁 😁 🖕 🏽,2,offensive,Homosexual,offensive,Homosexual,offensive,"Homosexual, Jewish",offensive
7528097_gab,fdr wife was an out and out dyke,3,offensive,Homosexual,offensive,Homosexual,offensive,Homosexual,offensive
26523675_gab,as long as women are in the game it nice to have some intelligent ones but like the homosexuals you will never get that cat back in the bag obama knew that,2,offensive,"Homosexual, Women",hatespeech,"Homosexual, Women",offensive,"Homosexual, Women",offensive
14010801_gab,bare naked islam brought to you by the bare naked ladies,2,hatespeech,"Islam, Women",hatespeech,"Islam, Women",normal,,hatespeech
24232732_gab,what a faggot fuck sessions the little bitch,2,offensive,Homosexual,offensive,"Homosexual, Women",offensive,Homosexual,offensive
1103664429156257792_twitter,<money> of buddha and bitches with beepers,0,normal,,normal,,normal,,normal
7996395_gab,most all of these so called refugees are young men of fighting age going out to invade the whole world and kill all who will not convert to islam,2,normal,,hatespeech,"Islam, Refugee",hatespeech,Islam,hatespeech
1264266111907885061_twitter,"idk why people think they went off when they say "" go back to palestine "" that ' ltrly the goal y ' all kno what a refugee is",0,normal,Other,normal,Refugee,offensive,Refugee,normal
12040186_gab,i would say obongo can be called a n-word as well as his beautiful wife man,3,hatespeech,"Other, African",hatespeech,African,hatespeech,African,hatespeech
1179097500042584064_twitter,lmao the fucking lying slut,3,offensive,Women,offensive,Women,offensive,Women,offensive
1179104713356320768_twitter,love getting fucking condescended to by the cis telling me im reductive and need to calm down bc i simply mentioned to a largely queer qnd inclusive group of ppl that certain devs are transphobic so they could save their money and said cis wouldnt let it be,0,normal,Homosexual,normal,,normal,,normal
24358018_gab,make amuriker kike again and again and again and,3,hatespeech,Jewish,offensive,Jewish,hatespeech,Jewish,hatespeech
1255658624149487622_twitter,lol <number> for a desk and <number> for shipping please fuck off i hate you,0,normal,,normal,,hatespeech,,normal
